{
  "ledger_version": 2,
  "mode": "shadow_traceability_only",
  "v1_inventory": "contracts/behavior-inventory-v1.json",
  "required_red_registry": "contracts/packs/required-red-v1.json",
  "obligations": [
    {
      "id": "SHADOW-V2-BHV-RED-P4-FORMAT-GRAMMAR-THREAD-START-TERMINAL",
      "kind": "v1_required_red",
      "legacy_id": "BHV-RED-P4-FORMAT-GRAMMAR-THREAD-START-TERMINAL",
      "aliases": [
        "BHV-RED-P4-FORMAT-GRAMMAR-THREAD-START-TERMINAL"
      ],
      "status": "pending",
      "reviewed": false,
      "rationale": "no direct executable golden isolates the exact thread-start terminal",
      "normative_source": "docs/v1/index.md"
    },
    {
      "id": "SHADOW-V2-BHV-RED-P4-FORMAT-GRAMMAR-THREAD-END-TERMINAL",
      "kind": "v1_required_red",
      "legacy_id": "BHV-RED-P4-FORMAT-GRAMMAR-THREAD-END-TERMINAL",
      "aliases": [
        "BHV-RED-P4-FORMAT-GRAMMAR-THREAD-END-TERMINAL"
      ],
      "status": "pending",
      "reviewed": false,
      "rationale": "no direct executable golden isolates the exact matching thread-end terminal",
      "normative_source": "docs/v1/index.md"
    },
    {
      "id": "SHADOW-V2-BHV-RED-P4-FORMAT-GRAMMAR-ROLE-USER-BOT-EXTERNAL",
      "kind": "v1_required_red",
      "legacy_id": "BHV-RED-P4-FORMAT-GRAMMAR-ROLE-USER-BOT-EXTERNAL",
      "aliases": [
        "BHV-RED-P4-FORMAT-GRAMMAR-ROLE-USER-BOT-EXTERNAL"
      ],
      "status": "pending",
      "reviewed": false,
      "rationale": "no direct executable golden proves all three role terminals and role mapping",
      "normative_source": "docs/v1/index.md"
    },
    {
      "id": "SHADOW-V2-BHV-RED-P4-FORMAT-GRAMMAR-LOCATION-AND-UUID",
      "kind": "v1_required_red",
      "legacy_id": "BHV-RED-P4-FORMAT-GRAMMAR-LOCATION-AND-UUID",
      "aliases": [
        "BHV-RED-P4-FORMAT-GRAMMAR-LOCATION-AND-UUID"
      ],
      "status": "pending",
      "reviewed": false,
      "rationale": "no direct executable golden covers malformed location and UUID terminals",
      "normative_source": "docs/v1/index.md"
    },
    {
      "id": "SHADOW-V2-BHV-RED-P4-FORMAT-METADATA-CLOSED-FORMS-AND-KINDS",
      "kind": "v1_required_red",
      "legacy_id": "BHV-RED-P4-FORMAT-METADATA-CLOSED-FORMS-AND-KINDS",
      "aliases": [
        "BHV-RED-P4-FORMAT-METADATA-CLOSED-FORMS-AND-KINDS"
      ],
      "status": "pending",
      "reviewed": false,
      "rationale": "no direct executable golden covers every closed metadata, external-author, and GitLab form",
      "normative_source": "docs/v1/index.md"
    },
    {
      "id": "SHADOW-V2-BHV-RED-P4-FORMAT-METADATA-TOKEN-FAILURES",
      "kind": "v1_required_red",
      "legacy_id": "BHV-RED-P4-FORMAT-METADATA-TOKEN-FAILURES",
      "aliases": [
        "BHV-RED-P4-FORMAT-METADATA-TOKEN-FAILURES"
      ],
      "status": "pending",
      "reviewed": false,
      "rationale": "no direct executable golden covers every nested duplicate, token-kind, escape, and non-object failure",
      "normative_source": "docs/v1/index.md"
    },
    {
      "id": "SHADOW-V2-BHV-RED-P4-FORMAT-CANONICAL-SORT-ENCODE-FINAL-LF",
      "kind": "v1_required_red",
      "legacy_id": "BHV-RED-P4-FORMAT-CANONICAL-SORT-ENCODE-FINAL-LF",
      "aliases": [
        "BHV-RED-P4-FORMAT-CANONICAL-SORT-ENCODE-FINAL-LF"
      ],
      "status": "pending",
      "reviewed": false,
      "rationale": "no direct executable golden binds sorted canonical output, compact encoding, and exactly one final LF",
      "normative_source": "docs/v1/index.md"
    },
    {
      "id": "SHADOW-V2-BHV-RED-P4-FORMAT-BODY-FRAMING-TRAILING-LF-INTERNAL-BLANKS",
      "kind": "v1_required_red",
      "legacy_id": "BHV-RED-P4-FORMAT-BODY-FRAMING-TRAILING-LF-INTERNAL-BLANKS",
      "aliases": [
        "BHV-RED-P4-FORMAT-BODY-FRAMING-TRAILING-LF-INTERNAL-BLANKS"
      ],
      "status": "pending",
      "reviewed": false,
      "rationale": "no direct executable golden binds decoded trailing logical LFs and internal blank body lines",
      "normative_source": "docs/v1/index.md"
    },
    {
      "id": "SHADOW-V2-BHV-RED-P4-FORMAT-RESERVED-PREFIX-EACH",
      "kind": "v1_required_red",
      "legacy_id": "BHV-RED-P4-FORMAT-RESERVED-PREFIX-EACH",
      "aliases": [
        "BHV-RED-P4-FORMAT-RESERVED-PREFIX-EACH"
      ],
      "status": "pending",
      "reviewed": false,
      "rationale": "no direct executable golden isolates each reserved-prefix body rejection",
      "normative_source": "docs/v1/index.md"
    },
    {
      "id": "SHADOW-V2-BHV-RED-P4-FORMAT-STRUCTURAL-MALFORMED-TERMINALS",
      "kind": "v1_required_red",
      "legacy_id": "BHV-RED-P4-FORMAT-STRUCTURAL-MALFORMED-TERMINALS",
      "aliases": [
        "BHV-RED-P4-FORMAT-STRUCTURAL-MALFORMED-TERMINALS"
      ],
      "status": "pending",
      "reviewed": false,
      "rationale": "no direct executable golden covers every missing, unmatched, premature, and malformed structural delimiter",
      "normative_source": "docs/v1/index.md"
    },
    {
      "id": "SHADOW-V2-BHV-RED-P4-FORMAT-NONCANONICAL-ENUMERATED-VARIANTS",
      "kind": "v1_required_red",
      "legacy_id": "BHV-RED-P4-FORMAT-NONCANONICAL-ENUMERATED-VARIANTS",
      "aliases": [
        "BHV-RED-P4-FORMAT-NONCANONICAL-ENUMERATED-VARIANTS"
      ],
      "status": "pending",
      "reviewed": false,
      "rationale": "no direct executable golden covers each accepted CRLF, order, metadata, final-LF, and omitted-separator formatter variant",
      "normative_source": "docs/v1/index.md"
    },
    {
      "id": "SHADOW-V2-BHV-RED-P4-FORMAT-CHECK-AND-WRITE-MATRIX",
      "kind": "v1_required_red",
      "legacy_id": "BHV-RED-P4-FORMAT-CHECK-AND-WRITE-MATRIX",
      "aliases": [
        "BHV-RED-P4-FORMAT-CHECK-AND-WRITE-MATRIX"
      ],
      "status": "pending",
      "reviewed": false,
      "rationale": "no direct executable golden binds check no-write versus write for every formatter-only variant",
      "normative_source": "docs/v1/index.md"
    },
    {
      "id": "SHADOW-V2-BHV-RED-P7-REPAIR-ONLY-MISSING-USER-BOT-METADATA-IDS",
      "kind": "v1_required_red",
      "legacy_id": "BHV-RED-P7-REPAIR-ONLY-MISSING-USER-BOT-METADATA-IDS",
      "aliases": [
        "BHV-RED-P7-REPAIR-ONLY-MISSING-USER-BOT-METADATA-IDS"
      ],
      "status": "pending",
      "reviewed": false,
      "rationale": "no direct executable golden proves repair rejects every non-ID and external metadata defect",
      "normative_source": "docs/v1/index.md"
    },
    {
      "id": "SHADOW-V2-BHV-RED-P7-REPAIR-FIX-PHYSICAL-ORDER-ASSIGNMENTS",
      "kind": "v1_required_red",
      "legacy_id": "BHV-RED-P7-REPAIR-FIX-PHYSICAL-ORDER-ASSIGNMENTS",
      "aliases": [
        "BHV-RED-P7-REPAIR-FIX-PHYSICAL-ORDER-ASSIGNMENTS"
      ],
      "status": "pending",
      "reviewed": false,
      "rationale": "no direct executable golden binds multi-ID assignment order to physical document order",
      "normative_source": "docs/v1/index.md"
    },
    {
      "id": "SHADOW-V2-BHV-RED-P7-REPAIR-FIX-RETRY-NOOP",
      "kind": "v1_required_red",
      "legacy_id": "BHV-RED-P7-REPAIR-FIX-RETRY-NOOP",
      "aliases": [
        "BHV-RED-P7-REPAIR-FIX-RETRY-NOOP"
      ],
      "status": "pending",
      "reviewed": false,
      "rationale": "no direct executable golden proves a retry after repair is changed:false with no assignments",
      "normative_source": "docs/v1/index.md"
    },
    {
      "id": "SHADOW-V2-BHV-RED-P7-REPAIR-REVISION-NULL-AND-CANONICAL",
      "kind": "v1_required_red",
      "legacy_id": "BHV-RED-P7-REPAIR-REVISION-NULL-AND-CANONICAL",
      "aliases": [
        "BHV-RED-P7-REPAIR-REVISION-NULL-AND-CANONICAL"
      ],
      "status": "pending",
      "reviewed": false,
      "rationale": "no direct executable golden covers repair-needed null canonical revision and normal canonical revision states",
      "normative_source": "docs/v1/index.md"
    },
    {
      "id": "SHADOW-V2-BHV-RED-P7-READ-VALIDATE-LIST-GET-CANONICAL",
      "kind": "v1_required_red",
      "legacy_id": "BHV-RED-P7-READ-VALIDATE-LIST-GET-CANONICAL",
      "aliases": [
        "BHV-RED-P7-READ-VALIDATE-LIST-GET-CANONICAL"
      ],
      "status": "pending",
      "reviewed": false,
      "rationale": "no direct executable golden binds successful validate/list/get DTOs for a populated canonical document",
      "normative_source": "docs/v1/index.md"
    },
    {
      "id": "SHADOW-V2-BHV-RED-P7-READ-MISSING-ZERO-WHITESPACE-MATRIX",
      "kind": "v1_required_red",
      "legacy_id": "BHV-RED-P7-READ-MISSING-ZERO-WHITESPACE-MATRIX",
      "aliases": [
        "BHV-RED-P7-READ-MISSING-ZERO-WHITESPACE-MATRIX"
      ],
      "status": "pending",
      "reviewed": false,
      "rationale": "no direct executable golden isolates every validate/list/get result and required error across missing, zero-byte, and whitespace targets",
      "normative_source": "docs/v1/index.md"
    },
    {
      "id": "SHADOW-V2-BHV-RED-P3-FLAGS-MUTATION-IF-REVISION-PLACEMENT-REPETITION-MISSING-VALUE-INVALID-VALUE",
      "kind": "v1_required_red",
      "legacy_id": "BHV-RED-P3-FLAGS-MUTATION-IF-REVISION-PLACEMENT-REPETITION-MISSING-VALUE-INVALID-VALUE",
      "aliases": [
        "BHV-RED-P3-FLAGS-MUTATION-IF-REVISION-PLACEMENT-REPETITION-MISSING-VALUE-INVALID-VALUE"
      ],
      "status": "pending",
      "reviewed": false,
      "rationale": "no direct executable revision-option matrix golden",
      "normative_source": "docs/v1/index.md"
    },
    {
      "id": "SHADOW-V2-BHV-RED-P3-FLAGS-MUTATION-LOCK-TIMEOUT-PLACEMENT-REPETITION-MISSING-VALUE-RANGE",
      "kind": "v1_required_red",
      "legacy_id": "BHV-RED-P3-FLAGS-MUTATION-LOCK-TIMEOUT-PLACEMENT-REPETITION-MISSING-VALUE-RANGE",
      "aliases": [
        "BHV-RED-P3-FLAGS-MUTATION-LOCK-TIMEOUT-PLACEMENT-REPETITION-MISSING-VALUE-RANGE"
      ],
      "status": "pending",
      "reviewed": false,
      "rationale": "no direct executable lock-timeout matrix golden",